website,"自分の所有するものを記録するホームページを作る","所要時間：約2時間半　|　参加費：2500円+税（事前予約制）",https://creative-community.space/org/howto/order.php,link,
website,"↑","ワークショップの練習に制作した中尾香織の所有するものを記録するホームページ（ワークショップ約4時間＋ワークショップ後に自身で編集数時間）",/kn/,link,
website,"↑","ワークショップの練習に制作したabiのthe best itemsを記録するホームページ（ワークショップ約3時間＋ワークショップ後に自身で編集約3時間）",/org/thebestitems/,link,
org,"所有するものを収納する箱を装飾する","所要時間：約45分　|　参加費：1000円+税　|　※予約不要",https://newlifecollection.com/ca88/1314/p-r-s/,link,
org,"↑","ポップアップのタイトルロゴのスクリーン版を制作しました。",https://64.media.tumblr.com/5c710d6861e18743f1f022f3c8ef8547/1a9f475960b876d1-e6/s2048x3072/388713e50836bd4b22b3f2437fee034da72514e0.jpg,link,
org,"↑","参加者特典：ポップアップのタイトルロゴをスクリーン印刷した箱（複数のサイズからお選びいただけます。）",https://www.instagram.com/p/ChQ9l0CLUXo/,link,
org,"↑","箱をラベルプリンタ・ハンディプリンタで装飾する例",https://www.instagram.com/p/ChSAYtzF3LL/,link,
map,"things that i (we) heard around BnA Alter Museum","私（わたしたち）がBnA Alter Museumの周りで聞いた言葉を集めた地図を制作します。",https://creative-community.space/map/heard/bnaaltermuseum/,link,
map,"↑","私（わたしたち）がBnA Alter Museumの周りで聞いた言葉を2F Cafeに展示します。",,none,
